{
  "previewInstruction": "<p><b>Read the clues.</b> Drag each friend onto a seat so all the clues are true at the same time. Then tap <b>CHECK</b>.</p><p style=\"font-size:0.9em;color:#666;\">Tip: <b>Left</b> and <b>right</b> are from <b>your</b> view, looking at the picture.</p>",
  "previewAudioText": "Read the clues, then drag each friend onto a seat so that every clue is true at the same time. When all the seats are full, tap CHECK. Left and right are from your view, looking at the picture.",
  "previewAudio": null,
  "showGameOnPreview": false,
  "totalRounds": 7,
  "timer": false,
  "answerComponent": true,
  "rounds": [
    {
      "set": "A",
      "id": "A_r1",
      "round": 1,
      "stage": 1,
      "type": "seating-puzzle",
      "seats": [
        1,
        2,
        3,
        4
      ],
      "adjacency": {
        "1": [
          2,
          4
        ],
        "2": [
          1,
          3
        ],
        "3": [
          2,
          4
        ],
        "4": [
          1,
          3
        ]
      },
      "acrossFrom": {
        "1": 3,
        "2": 4,
        "3": 1,
        "4": 2
      },
      "leftNeighbour": {
        "1": 2,
        "2": 3,
        "3": 4,
        "4": 1
      },
      "headSeat": null,
      "chips": [
        {
          "id": "anu",
          "name": "Anu",
          "avatar": "👧"
        },
        {
          "id": "ravi",
          "name": "Ravi",
          "avatar": "👦"
        },
        {
          "id": "priya",
          "name": "Priya",
          "avatar": "🧒"
        },
        {
          "id": "neha",
          "name": "Neha",
          "avatar": "👧"
        }
      ],
      "clues": [
        {
          "text": "Anu sits in seat 1.",
          "kind": "seat-pin",
          "args": [
            "anu",
            1
          ]
        },
        {
          "text": "Ravi sits to the left of Anu.",
          "kind": "left-of",
          "args": [
            "ravi",
            "anu"
          ]
        },
        {
          "text": "Priya is across from Anu.",
          "kind": "across-from",
          "args": [
            "priya",
            "anu"
          ]
        }
      ],
      "solution": {
        "1": "anu",
        "2": "ravi",
        "3": "priya",
        "4": "neha"
      },
      "answer": {
        "seating": {
          "1": "anu",
          "2": "ravi",
          "3": "priya",
          "4": "neha"
        },
        "distractor": null
      },
      "misconception_tags": {
        "next-to": "next-to-constraint-overlooked",
        "across-from": "across-from-constraint-overlooked",
        "left-of": "left-right-orientation-confused",
        "between": "between-constraint-misread",
        "head-of-table": "head-anchor-overlooked",
        "not-next-to": "negation-clue-misread",
        "seat-pin": "absolute-seat-pin-overlooked",
        "distractor-not-recognised": "distractor-not-recognised"
      }
    },
    {
      "set": "A",
      "id": "A_r2",
      "round": 2,
      "stage": 1,
      "type": "seating-puzzle",
      "seats": [
        1,
        2,
        3,
        4
      ],
      "adjacency": {
        "1": [
          2,
          4
        ],
        "2": [
          1,
          3
        ],
        "3": [
          2,
          4
        ],
        "4": [
          1,
          3
        ]
      },
      "acrossFrom": {
        "1": 3,
        "2": 4,
        "3": 1,
        "4": 2
      },
      "leftNeighbour": {
        "1": 2,
        "2": 3,
        "3": 4,
        "4": 1
      },
      "headSeat": null,
      "chips": [
        {
          "id": "ravi",
          "name": "Ravi",
          "avatar": "👦"
        },
        {
          "id": "priya",
          "name": "Priya",
          "avatar": "🧒"
        },
        {
          "id": "neha",
          "name": "Neha",
          "avatar": "👧"
        },
        {
          "id": "anu",
          "name": "Anu",
          "avatar": "👧"
        }
      ],
      "clues": [
        {
          "text": "Priya sits in seat 2.",
          "kind": "seat-pin",
          "args": [
            "priya",
            2
          ]
        },
        {
          "text": "Neha sits to the left of Priya.",
          "kind": "left-of",
          "args": [
            "neha",
            "priya"
          ]
        },
        {
          "text": "Anu is across from Priya.",
          "kind": "across-from",
          "args": [
            "anu",
            "priya"
          ]
        }
      ],
      "solution": {
        "1": "ravi",
        "2": "priya",
        "3": "neha",
        "4": "anu"
      },
      "answer": {
        "seating": {
          "1": "ravi",
          "2": "priya",
          "3": "neha",
          "4": "anu"
        },
        "distractor": null
      },
      "misconception_tags": {
        "next-to": "next-to-constraint-overlooked",
        "across-from": "across-from-constraint-overlooked",
        "left-of": "left-right-orientation-confused",
        "between": "between-constraint-misread",
        "head-of-table": "head-anchor-overlooked",
        "not-next-to": "negation-clue-misread",
        "seat-pin": "absolute-seat-pin-overlooked",
        "distractor-not-recognised": "distractor-not-recognised"
      }
    },
    {
      "set": "A",
      "id": "A_r3",
      "round": 3,
      "stage": 1,
      "type": "seating-puzzle",
      "seats": [
        1,
        2,
        3,
        4
      ],
      "adjacency": {
        "1": [
          2,
          4
        ],
        "2": [
          1,
          3
        ],
        "3": [
          2,
          4
        ],
        "4": [
          1,
          3
        ]
      },
      "acrossFrom": {
        "1": 3,
        "2": 4,
        "3": 1,
        "4": 2
      },
      "leftNeighbour": {
        "1": 2,
        "2": 3,
        "3": 4,
        "4": 1
      },
      "headSeat": null,
      "chips": [
        {
          "id": "priya",
          "name": "Priya",
          "avatar": "🧒"
        },
        {
          "id": "neha",
          "name": "Neha",
          "avatar": "👧"
        },
        {
          "id": "anu",
          "name": "Anu",
          "avatar": "👧"
        },
        {
          "id": "ravi",
          "name": "Ravi",
          "avatar": "👦"
        }
      ],
      "clues": [
        {
          "text": "Priya sits in seat 3.",
          "kind": "seat-pin",
          "args": [
            "priya",
            3
          ]
        },
        {
          "text": "Ravi sits to the left of Priya.",
          "kind": "left-of",
          "args": [
            "ravi",
            "priya"
          ]
        },
        {
          "text": "Neha is across from Priya.",
          "kind": "across-from",
          "args": [
            "neha",
            "priya"
          ]
        }
      ],
      "solution": {
        "1": "neha",
        "2": "anu",
        "3": "priya",
        "4": "ravi"
      },
      "answer": {
        "seating": {
          "1": "neha",
          "2": "anu",
          "3": "priya",
          "4": "ravi"
        },
        "distractor": null
      },
      "misconception_tags": {
        "next-to": "next-to-constraint-overlooked",
        "across-from": "across-from-constraint-overlooked",
        "left-of": "left-right-orientation-confused",
        "between": "between-constraint-misread",
        "head-of-table": "head-anchor-overlooked",
        "not-next-to": "negation-clue-misread",
        "seat-pin": "absolute-seat-pin-overlooked",
        "distractor-not-recognised": "distractor-not-recognised"
      }
    },
    {
      "set": "A",
      "id": "A_r4",
      "round": 4,
      "stage": 1,
      "type": "seating-puzzle",
      "seats": [
        1,
        2,
        3,
        4
      ],
      "adjacency": {
        "1": [
          2,
          4
        ],
        "2": [
          1,
          3
        ],
        "3": [
          2,
          4
        ],
        "4": [
          1,
          3
        ]
      },
      "acrossFrom": {
        "1": 3,
        "2": 4,
        "3": 1,
        "4": 2
      },
      "leftNeighbour": {
        "1": 2,
        "2": 3,
        "3": 4,
        "4": 1
      },
      "headSeat": null,
      "chips": [
        {
          "id": "neha",
          "name": "Neha",
          "avatar": "👧"
        },
        {
          "id": "anu",
          "name": "Anu",
          "avatar": "👧"
        },
        {
          "id": "ravi",
          "name": "Ravi",
          "avatar": "👦"
        },
        {
          "id": "priya",
          "name": "Priya",
          "avatar": "🧒"
        }
      ],
      "clues": [
        {
          "text": "Ravi sits in seat 4.",
          "kind": "seat-pin",
          "args": [
            "ravi",
            4
          ]
        },
        {
          "text": "Neha sits to the left of Ravi.",
          "kind": "left-of",
          "args": [
            "neha",
            "ravi"
          ]
        },
        {
          "text": "Anu is across from Ravi.",
          "kind": "across-from",
          "args": [
            "anu",
            "ravi"
          ]
        }
      ],
      "solution": {
        "1": "neha",
        "2": "anu",
        "3": "priya",
        "4": "ravi"
      },
      "answer": {
        "seating": {
          "1": "neha",
          "2": "anu",
          "3": "priya",
          "4": "ravi"
        },
        "distractor": null
      },
      "misconception_tags": {
        "next-to": "next-to-constraint-overlooked",
        "across-from": "across-from-constraint-overlooked",
        "left-of": "left-right-orientation-confused",
        "between": "between-constraint-misread",
        "head-of-table": "head-anchor-overlooked",
        "not-next-to": "negation-clue-misread",
        "seat-pin": "absolute-seat-pin-overlooked",
        "distractor-not-recognised": "distractor-not-recognised"
      }
    },
    {
      "set": "A",
      "id": "A_r5",